institute,city,url
Technological Institute of Mazatlán,Mazatlán,http://www.itmazatlan.edu.mx
Technological Institute of Merida,Mérida,http://www.itmerida.mx
Technological Institute of Mexicali,Mexicali,http://www.itmexicali.edu.mx
Technological Institute of Milpa Alta,Ciudad de Mexico,http://www.itmilpaalta.edu.mx/
Technological Institute of Milpa Alta II,Ciudad de México,http://itmilpaalta2.mx
Technological Institute of Minatitlán,Minatitlán,http://www.itmina.edu.mx
Technological Institute of Morelia,Morelia,http://www.tecmor.mx
Technological Institute of Nogales,Nogales,http://www.itnogales.edu.mx/
Technological Institute of Nuevo Laredo,Nuevo Laredo,http://www.itnuevolaredo.edu.mx
Technological Institute of Nuevo León,Ciudad Guadalupe,http://www.itnl.edu.mx
Technological Institute of Oaxaca,Oaxaca,http://www.itoaxaca.edu.mx
Technological Institute of Ocotlán,Ocotlán,http://www.itocotlan.edu.mx
Technological Institute of Orizaba,Orizaba,http://www.itorizaba.edu.mx
Technological Institute of Pabelló Arteaga,Pabellón de Arteaga,http://www.itpabellon.edu.mx
Technological Institute of Pachuca,Pachuca,http://www.itpachuca.edu.mx
Technological Institute of Parral,Hidalgo del Parral,http://www.itparral.edu.mx
Technological Institute of Piedras Negras,Piedras Negras,http://www.itpiedrasnegras.edu.mx
Technological Institute of Pinotepa,Pinotepa Nacional,http://www.itp.edu.mx
Technological Institute of Pochutla,San Pedro Pochutla,http://www.itpochutla.edu.mx
Technological Institute of Puebla,Puebla,Webpage-Not-Found
Technological Institute of Querétaro,Querétaro,http://www.itq.edu.mx
Technological Institute of Reynosa,Ciudad Reynosa,http://www.tecreynosa.edu.mx
Technological Institute of Roque,Celaya,http://www.itroque.edu.mx
Technological Institute of Salina Cruz,Salina Cruz,http://www.itsalinacruz.edu.mx
Technological Institute of Saltillo,Saltillo,http://www.its.mx
Technological Institute of San Juan del Río,San Juan del Río,http://www.itsanjuan.edu.mx
Technological Institute of San Luis Potosí,Soledad de Graciano Sánchez,http://www.itslp.edu.mx/
Technological Institute of San Marcos,San Marcos,http://www.itsmgro.edu.mx
Technological Institute of Sinaloa de Leyva,Sinaloa de Leyva,http://itsinaloadeleyva.com.mx/academico
Technological Institute of Sonora,Ciudad Obregón,https://www.itson.mx
Technological Institute of Tapachula,Tapachula,http://www.ittapachula.edu.mx
Technological Institute of Tecomatlán,Tecomatlán,http://www.itapuebla.edu.mx
Technological Institute of Tehuácan,Tehuacán,http://www.ittehuacan.edu.mx
Technological Institute of Telephones of Mexico,México,http://inttelmex.telmex.com/inttelmexit
Technological Institute of Tepic,Tepic,http://www.ittepic.edu.mx
Technological Institute of the Altiplano of Tlaxcala,San Diego Xocoyucan,http://www.italtiplanotlaxcala.edu.mx
Technological Institute of the Chontalpa,Nacajuca,http://itchontalpa.edu.mx
Technological Institute of the Costa Grande,Zihuatanejo,Webpage-Not-Found
Technological Institute of the Isthmus,Juchitán de Zaragoza,http://www.itistmo.edu.mx
Technological Institute of the Maya Area,Chetumal,http://www.itzonamaya.edu.mx
Technological Institute of the Mixe Region,Santa Maria Tlahuitoltepec,http://www.itrm.edu.mx
Technological Institute of the Morelia Valley,Morelia,http://www.itvallemorelia.edu.mx
Technological Institute of the Olmeca Region,Villahermosa,http://www.itzonaolmeca.edu.mx
Technological Institute of the River Basin of Papaloapan,Tuxtepec,http://itcuencadelpapaloapan.com
Technological Institute of the Valley of Oaxaca,Xoxocotlán,http://www.itvalleoaxaca.edu.mx
Technological Institute of the Valley of the Guadiana (Villa Montemorelos),Montemorelos,http://www.itvalledelguadiana.edu.mx
Technological Institute of the Valley of Yaqui,Bácum,http://www.itvalledelyaqui.edu.mx
Technological Institute of Tijuana,Tijuana,http://www.tectijuana.mx
Technological Institute of Tizimin,Tizimín,http://www.ittizimin.edu.mx
Technological Institute of Tláhuac,Ciudad de México,http://www.ittlahuac.edu.mx
Technological Institute of Tláhuac II,Ciudad de México,http://www.ittlahuac2.edu.mx
Technological Institute of Tlajomulco,Tlajomulco de Zúñiga,http://www.ittlajomulco.edu.mx
Technological Institute of Tlalnepantla,Tlalnepantla,http://www.ittla.edu.mx
Technological Institute of Tlalpan,Ciudad de México,http://www.ittlalpan.edu.mx
Technological Institute of Tlaxiaco,Tlaxiaco,http://www.ittlaxiaco.edu.mx
Technological Institute of Toluca,Metepec,http://www.ittoluca.edu.mx
Technological Institute of Torreon,Torreón,http://www.ittorreon.edu.mx
Technological Institute of Tuxtepec,Tuxtepec,http://www.ittux.edu.mx
Technological Institute of Tuxtla Gutierrez,Tuxtla Gutiérrez,http://www.ittuxtlagutierrez.edu.mx
Technological Institute of Úrsulo Galván,Úrsulo Galván,http://www.itursulogalvan.edu.mx
Technological Institute of Veracruz,Veracruz,http://www.itver.edu.mx
Technological Institute of Villahermosa,Villahermosa,http://www.itvillahermosa.edu.mx
Technological Institute of Zacatecas,Zacatecas,http://www.itz.edu.mx
Technological Institute of Zacatepec,Zacatepec,http://www.itzacatepec.edu.mx
Technological Institute of Zitácuaro,Zitácuaro,http://www.itzitacuaro.edu.mx
Technological University Bahía de Banderas,Nuevo Vallarta,http://www.utbb.edu.mx
Technological University Institute of Mexico - University,México,http://www.tum.edu.mx
Technological University of Acapulco,Acapulco,http://utacapulco.wix.com/utda
Technological University of Altamira,Altamira,http://www.utaltamira.edu.mx
Technological University of Cadereyta,Cadereyta Jiménez,http://www.utcadereyta.edu.mx
Technological University of Calvillo,Calvillo,http://www.utcalvillo.edu.mx
Technological University of Camargo,Camargo,http://www.utcamargo.edu.mx
Technological University of Campeche,Campeche,http://www.utcam.edu.mx
Technological University of Cancun,Cancún,http://www.utcancun.edu.mx/
Technological University of Centro de Veracruz,Cuitláhuac,http://www.utcv.edu.mx
Technological University of Chetumal,Chetumal,http://www.utchetumal.edu.mx/portal
Technological University of Chihuahua,Chihuahua,http://www.utch.edu.mx
Technological University of Ciudad Juarez,Ciudad Juárez,http://www.utcj.edu.mx
Technological University of Coahuila,Ramos Arizpe,http://www.utc.edu.mx
Technological University of Durango,Durango,http://www.utd.edu.mx
Technological University of Escuinapa,Escuinapa,http://utescuinapa.edu.mx
"Technological University of Gutierrez Zamora, Veracruz",Gutiérrez Zamora,http://www.utgz.edu.mx
Technological University of Hermosillo,Hermosillo,http://www.uthermosillo.edu.mx
Technological University of Huejotzingo,Huejotzingo,http://www.uth.edu.mx/
Technological University of Izúcar de Matamoros,Izúcar de Matamoros,Webpage-Not-Found
Technological University of Jalisco,Guadalajara,http://www.utj.edu.mx/
Technological University of La Paz,La Paz,http://www.utlp.edu.mx
Technological University of Leon,León,http://www.utleon.edu.mx
Technological University of Manzanillo,Manzanillo,http://www.utmanzanillo.net
Technological University of Mar de Tamaulipas Bicentennial,Soto la Marina,http://www.utmart.edu.mx
Technological University of Matamoros,Matamoros,http://www.utmatamoros.edu.mx
Technological University of Mexico,México,http://www.unitec.mx
Technological University of Morelia,Morelia,http://www.utmorelia.edu.mx
Technological University of Nayarit,Xalisco,http://www.utnay.edu.mx
Technological University of Nezahualcóyotl,Nezahualcóyotl,http://www.utn.edu.mx
Technological University of Nogales,Nogales,http://www.utnogales.edu.mx
Technological University of North Tamaulipas,Reynosa,http://www.uttn.edu.mx
Technological University of Nuevo Laredo,Nuevo Laredo,http://www.utnuevolaredo.edu.mx
Technological University of Oriental,Oriental,http://uto.edu.mx
Technological University of Poanas,Poanas,http://www.utpoanas.edu.mx
Technological University of Poniente,Maxcanú,http://www.utponiente.edu.mx
Technological University of Puebla,Puebla,http://www.utpuebla.edu.mx
Technological University of Puerto Penasco,Puerto Peñasco,http://utpp.edu.mx
Technological University of Queretaro,Querétaro,http://www.uteq.edu.mx
Technological University of Rodeo,Rodeo,http://utrodeo.edu.mx
Technological University of Salamanca,Salamanca,http://www.utsalamanca.edu.mx
Technological University of San Juan del Río,San Juan del Río,http://www.utsjr.edu.mx
Technological University of San Luis Potosi,San Luis Potosí,http://www.utslp.edu.mx
Technological University of San Luis Rio Colorado,San Luis Río Colorado,www.utslrc.edu.mx
Technological University of San Miguel de Allende,San Miguel de Allende,http://www.utsma.edu.mx
Technological University of Santa Catarina,Santa Catarina,http://www.utsc.edu.mx
Technological University of Southern Chihuahua,Chihuahua,http://www.utchsur.edu.mx
Technological University of Southern Sonora,Ciudad Obregón,http://www.uts.edu.mx/
Technological University of Tabasco,Villahermosa,http://www.uttab.edu.mx
Technological University of Tecamac,Tecámac,http://www.uttecamac.edu.mx
Technological University of Tecamachalco,Tecamachalco,http://www.uttecam.edu.mx
Technological University of Tehuacán,Tehuacán,http://www.uttehuacan.edu.mx
Technological University of the Central Region of Coahuila,Monclova,http://www.utrcc.edu.mx
Technological University of the Central Valleys of Oaxaca,Oaxaca,http://www.utvco.edu.mx
Technological University of the Centre of Mexico,Celaya,http://www.utec-celaya.edu.mx
Technological University of the Coast,Santiago Ixcuintla,http://www.utdelacosta.edu.mx
Technological University of the Coast of Guerrero,Petatlán,http://www.utcgg.edu.mx
Technological University of the Forest,Ocosingo,http://www.utselva.edu.mx
Technological University of the Hidalgo Sierra,Zacualtipán de los Ángeles,http://www.utsh.edu.mx
Technological University of the Huasteca Region of Hidalgo,Huejutla de Reyes,http://www.uthh.edu.mx
Technological University of the Metropolitan Zone of Guadalajara,Tlajomulco de Zúñiga,http://www.utzmg.edu.mx
Technological University of the North of Aguascalientes,Aguascalientes,http://www.utna.edu.mx
Technological University of the North of Guanajuato,Dolores Hidalgo,http://www.utng.edu.mx
Technological University of the Northern Region of Guerrero,Iguala de la Independencia,http://utrng.edu.mx
Technological University of the Riviera Maya,Playa del Carmen,http://www.utrivieramaya.edu.mx
Technological University of the South of Morelos State,Puente de Ixtla,http://www.utsem-morelos.edu.mx
Technological University of the South of the State of Mexico,Tejupilco,http://www.utsem.edu.mx
Technological University of the South Sierra of Oaxaca,Oaxaca,http://utsso.edu.mx
Technological University of the South West of Guanajuato,Valle de Santiago,http://www.utsoe.edu.mx
Technological University of the State of Zacatecas,Guadalupe,http://www.utzac.edu.mx
Technological University of the Tarahumara,Guachochi,http://www.uttarahumara.edu.mx
Technological University of the Valley of the Mezquital,Ixmiquilpán,http://www.utvm.edu.mx
Technological University of the Valley of Toluca,Lerma,http://www.utvtol.edu.mx
Technological University of Tijuana,Tijuana,http://www.uttijuana.edu.mx
Technological University of Tlaxcala,Huamantla,http://www.uttlaxcala.edu.mx
Technological University of Torreon,Torreón,http://www.utt.edu.mx
Technological University of Tula-Tepeji,Tula de Allende,http://www.uttt.edu.mx
Technological University of Tulancingo,Tulancingo,http://www.utec-tgo.edu.mx/
Technological University of Usumacinta,Emiliano Zapata,http://www.utusumacinta.edu.mx
Technological University of Xicotepec de Juárez,Xicotepec de Juárez,http://www.utxj.edu.mx
TecMilenio University,Tapachula,http://www.tecmilenio.edu.mx
Tecomán Institute of Higher Education,Tecomán,Webpage-Not-Found
Tecpatl Centre of Advanced Studies,Tepatitlán de Morelos,Webpage-Not-Found
Teleddes Foundation (Telecommunications for Education and Development),Ensenada,http://www.fundacionteleddes.org
Tepeyac Institute,León,http://www.ites.edu.mx
Terranova University,Toluca,Webpage-Not-Found
The Americas Institute of Higher Studies,Mérida,Webpage-Not-Found
The Americas Institute of Nayarit,Tepic,http://www.ilan.com.mx
The College of Jalisco,Zapopan,http://www.coljal.edu.mx
The College of Leon,León,http://elcolegiodeleon.org
The College of Mexico,México,https://www.colmex.mx
The College of Michoacan,Zamora,http://www.colmich.edu.mx
The College of Puebla,Puebla,http://www.colpue.edu.mx/
The College of San Luis,San Luis Potosí,http://www.colsan.edu.mx
The College of Sinaloa,Culiacán,http://www.elcolegiodesinaloa.com
The College of Sonora,Hermosillo,http://www.colson.edu.mx/
The College of Tamaulipas,Ciudad Victoria,http://www.coltam.edu.mx
"The College of the Northern Frontier, A.C.",Tijuana,http://www.colef.mx
The College of the Southern Frontier,San Cristóbal de las Casas,http://www.ecosur.mx
The College of the State of Mexico,Zinacantepec,http://www.cmq.edu.mx
"Third Millennium Institute of Technical Basic, Intermediate and Higher Education",Zapopan,Webpage-Not-Found
Thomas Aquinas Centre for Studies in Philosophy,León,http://www.filosofiacefta.com
Tito Puente University,Puebla,https://universidadtitopuente.edu.mx
Tominaga Nakamoto University,Naucalpán de Juárez,http://utominaga.edu.mx/utominaga
Total Tourism Technology,Mérida,http://www.tttac.com
Trade Union Centre of Advanced Studies of the CTM,Cuernavaca,Webpage-Not-Found
Training and Research Institute in Psychotherapy,México,http://www.institutopersonas.org
Training Institute in Psychotherapy,Veracruz,Webpage-Not-Found
Transpersonal Development University Institute,Puebla,http://www.transpersonal.edu.mx
Trilingual Centre For Advances Studies,México,http://www.centrotrilingue.edu.mx/
Tuxtla University of Advanced Studies,Tuxtla Gutiérrez,Webpage-Not-Found
UNE Business University,Boca del Río,Webpage-Not-Found
UNIVER University,Guadalajara,http://www.univer.com.mx
Universidad Autónoma Metropolitana,México,https://www.uam.mx
Universidad de las Artes - Instituto cultural de las Aguascalientes,Aguascalientes,http://www.aguascalientes.gob.mx/temas/cultura/webua/menu.html
Universisity of the Huasteca Veracruz,Poza Rica,http://www.uhv.edu.mx
University and Open Education Systems of Irapuato,Irapuato,Webpage-Not-Found
University Centre for Commerce and Diplomacy of Zacatecas,Zacatecas,Webpage-Not-Found
University Centre for Education and Culture,San Nicolás de Los Garza,http://www.unicuec.com
University Centre for Journalism and Advertising Studies,Cuauhtémoc,http://www.cupp.mx
"University Centre for Studies in Languages, Tourism and Services",Cuernavaca,http://www.cultures.edu.mx
University Centre in Marketing and Advertising Studies,Naucalpán de Juárez,http://www.cump.edu.mx
University Centre of Art Education,Tixtla de Guerrero,Webpage-Not-Found
University Centre of Business Management,León,http://cuden.edu.mx
University Centre of Chihuahua,Chihuahua,Webpage-Not-Found
University Centre of Ciudad Juárez,Ciudad Juárez,http://www.cucj.com
University Centre of Eastern Hidalgo,Tulancingo,http://www.cuoh.edu.mx
University Centre of Hidalgo,Pachuca,http://www.cuh.edu.mx
University Centre of Huatusco,Huatusco,http://www.cuh.com
University Centre of Human Integration,Naucalpán de Juárez,http://cuih.edu.mx/
University Centre of Ixtlahuaca,Ixtlahuaca,http://uicui.edu.mx
University Centre of Puebla,Puebla,Webpage-Not-Found
University Centre of Salina Cruz,Salina Cruz,http://ceunisalcus.galeon.com
University Centre of Tenango del Valle,Tenango del Valle,http://www.cutvac.edu.mx
University Centre of the City of Mexico,México,http://ateneofilosofico.org.mx/ucime.html
University Centre of the North-East,Matamoros,http://www.cun.com.mx
University Centre of the Sea of Cortez,Culiacán,http://online.marco.edu.mx
University Centre of the South Pacific,Acapulco de Juárez,Webpage-Not-Found
University Centre of the Valley of Teotihuacan,Teotihuacán,http://cuvate.edu.mx
University Centre of the Valley of Zacapu,Zacapu,http://cuvz.edu.mx/
University Centre of the West,Guadalajara,Webpage-Not-Found
University Centre of Xalapa,Xalapa,Webpage-Not-Found
University Centre of Xalapa Cordoba Branch,Cordoba,Webpage-Not-Found
University Centre Specialized in Business Studies,México,Webpage-Not-Found
University College of Business Studies,Toluca,http://www.cufem.com
University College of Puebla,Puebla,http://www.unicup.edu.mx
University College of the Americas,Cuernavaca,Webpage-Not-Found
University Cultural Centre of Ciudad Juárez,Ciudad Juárez,http://www.ccu.mx
University for Football and Sports Science,San Agustín Tlaxcala,http://www.ufd.mx
University for Professional Development,Aguascalientes,http://www.unidep.edu.mx
University for the Development of the State of Puebla,Puebla,http://www.unides.edu.mx
University Fray Luca Paccioli,Cuernavaca,http://www.uflp.edu.mx
University Institute in Administration Systems of Monterrey,Monterrey,http://www.tuscreen.com/iusam
University Institute of Nezahualcóyotl,Nezahualcóyotl,http://www.univerneza.com/home.html
University Institute of Technology and Humanities,Puebla,http://iunivertech.com.mx
University Institute of the East,Valladolid,Webpage-Not-Found
University Institute of the Lake and Sun,Valle de Bravo,Webpage-Not-Found
University Institute of the State of Mexico,Metepec,http://www.universidadiuem.edu.mx
University Institute of the Valley of Santiago,Saltillo,http://www.iunivas.edu.mx
University Institute of Tourism and Gastronomy,México,Webpage-Not-Found
University Institute of Veracruz,Banderilla,http://www.iuv.edu.mx
University of Academic Studies of the Americas,Guadalajara,Webpage-Not-Found
University of Acayucán,Villa Oluta,Webpage-Not-Found
University of Advanced Communication,Monterrey,http://www.unica.edu.mx
University of Arts and Sciences of Chiapas,Tuxtla Gutiérrez,http://www.unicach.edu.mx
University of Business and Pedagogical Development,México,http://www.univdep.edu.mx
University of Celaya,Celaya,http://www.udec.edu.mx
University of Central Bajío,Celaya,http://www.uniceba.edu.mx
University of Communication,México,http://www.uc.edu.mx
University of Communication Sciences of Puebla,Puebla,http://www.ucic.edu.mx
University of Conde,Coatepec,http://universidaddelconde.edu.mx
University of Contemporary Mexico,Ixtapaluca,http://unimec.com.mx
University of Cuautitlán Izcalli,Cuautitlán Izcalli,http://www.udeci.edu.mx
University of Ecatepec,Ecatepec de Morelos,http://www.uecatepec.edu.mx
"University of Guadalajara
La Ciénega University Centre",Ocotlán,http://cuci.udg.mx
University of Hermosillo,Hermosillo,http://www.udeh.us
Not-Found,Not-found,Webpage-Not-Found
Not-Found,Not-found,Webpage-Not-Found
Not-Found,Not-found,Webpage-Not-Found
Not-Found,Not-found,Webpage-Not-Found
Not-Found,Not-found,Webpage-Not-Found
Not-Found,Not-found,Webpage-Not-Found
Not-Found,Not-found,Webpage-Not-Found
Not-Found,Not-found,Webpage-Not-Found
Not-Found,Not-found,Webpage-Not-Found
Not-Found,Not-found,Webpage-Not-Found
University of Morelia,Morelia,http://www.udemorelia.edu.mx
University of Navojoa,Navojoa,http://www.unavojoa.net
University of North America,Naucalpán de Juárez,http://www.un.mx
University of Open and Distance Education of Mexico,Ciudad de México,http://www.unadmexico.mx
University of Professional Studies in Science and Arts,León,http://www.epca.edu.mx
University of Puebla,Puebla,http://www.unipuebla.com.mx
University of Quintana Roo,Chetumal,http://www.uqroo.mx
University of Sahagún,México,Webpage-Not-Found
University of Science and Arts of Potosi,San Luis Potosí,http://ucap.edu.mx
University of Science and Humanities of Veracruz Quetzalcoatl,Veracruz,http://www.uniquetzalver.com
University of Sonora,Hermosillo,https://www.unison.mx
University of Sotavento,Coatzacoalcos,http://www.us.edu.mx
"University of Sotavento
Orizaba Branch",Orizaba,http://us.edu.mx/web/orizaba
"University of Sotavento
Villahermosa Branch",Villahermosa,http://us.edu.mx/web/villahermosa
University of Specialities,Guadalajara,http://www.universidad-une.com
University of Tamaulipeca,Reynosa,http://www.universidadtamaulipeca.edu.mx
University of Tepeyac,México,http://www.tepeyac.edu.mx
University of the Álica,Tepic,http://www.universidaddelalica.edu.mx
University of the Altiplano,Tlaxcala,http://www.universidaddelaltiplano.com
University of the Americas of Mexico City,México,http://www.udlacdmx.mx
University of the Americas Puebla,Cholula,https://www.udlap.mx
University of the Armed and Air Forces,México,Webpage-Not-Found
University of the Atlantic,Matamoros,http://www.uda.edu.mx
University of the Californias International,Tijuana,http://www.udc.com.mx
University of the Caribbean,Cancún,http://www.unicaribe.edu.mx
University of the Centre of Mexico,San Luis Potosí,http://www.ucem.edu.mx
University of the Centre of Veracruz,Tres Valles,http://www.unicver.edu.mx
University of the Ciénega of the State of Michoacan de Ocampo,Sahuayo,http://www.ucienegam.edu.mx
University of the Cloister of Sor Juana,México,http://elclaustro.edu.mx
University of the East,Puebla,http://www.uo.edu.mx
University of the Federal District,México,http://www.udf.edu.mx
University of the Gulf,Tampico,http://www.unigolfo.edu.mx
University of the Gulf of Mexico,Orizaba,http://www.ugm.edu.mx
University of the Isthmus,Ixtepec,https://www.unistmo.edu.mx
University of the Nations,Veracruz,http://www.uninaciones.com
University of the North,Monterrey,http://www.un.edu.mx
University of the Northeast,Tampico,http://www.une.edu.mx
University of the Northeast of Mexico,Rio Bravo,http://www.unm.edu.mx
University of the Northwest,Hermosillo,Webpage-Not-Found
University of the Pacific of Chiapas,Arriaga,http://www.upach-eca.edu.mx
University of the Papaloapan,Loma Bonita,https://www.unpa.edu.mx
Not-Found,Not-found,Webpage-Not-Found
University of the Sierra,Moctezuma,http://www.universidaddelasierra.edu.mx
University of the Sierra,Huauchinango,http://www.usac.edu.mx
University of the Sierra Juarez,Ixtlán de Juárez,http://www.unsij.edu.mx
University of the Sierra Sur,Miahuatlán de Porfirio Díaz,http://www.unsis.edu.mx
University of the Soconusco Region,Tapachula,http://www.cucs.edu.mx
University of the South-East,Comitán,http://www.uds.mx
University of the Sun,Cuernavaca,http://www.unisol.edu.mx
University of the Tacana,Tapachula,http://www.utac.edu.mx
University of the Third Millennium,Boca de Río,http://universidad.u3m.edu.mx
University of the Valley of Atemajac,Zapopan,https://www.univa.mx
University of the Valley of Cuernavaca,Cuernavaca,http://www.univac.edu.mx
University of the Valley of Guadiana,Durango,http://www.uvguad.edu.mx
University of the Valley of Matatipac,Tepic,http://www.univam.edu.mx
University of the Valley of Mexico,México,http://www.uvmnet.edu
University of the Valley of Orizaba,Orizaba,http://www.univo.edu.mx
University of the Valley of Poza Rica,Poza Rica,http://www.uvpr.edu.mx
University of the Valley of Puebla,Puebla,http://www.uvp.edu.mx
University of the Valley of the Grijalva,Tuxtla Gutiérrez,http://www.uvg.edu.mx
University of the Valley of Tlaxcala,Tzompantepec,http://www.univalletlax.edu.mx/
University of the Valley of Toluca,Toluca,http://www.uvt.edu.mx
University of the West,Los Mochis,http://www.udo.mx
University of Tijuana,Tijuana,http://cut.edu.mx
University of Tourism and Administration,México,http://www.eph-utca.edu.mx
University of Valladolid Yucatan,Valladolid,http://uvy.edu.mx
University of Valle del Fuerte,Los Mochis,http://www.univafu.edu.mx
"University of Veracruz
Coatzacoalcos-Minatitlán Region",Coatzacoalcos,http://www.uv.mx/coatza
"University of Veracruz
Orizaba-Córdoba Region",Orizaba,http://www.uv.mx/orizaba
"University of Veracruz
Poza Rica-Tuxpán Region",Poza Rica,https://www.uv.mx/pozarica
"University of Veracruz
Veracruz Region",Boca del Río,http://www.uv.mx/veracruz
University of Xalapa,Xalapa,http://www.ux.edu.mx
University of Xicotepetl,Xicotepec de Juárez,http://www.uxac.edu.mx
University of Zamora,Zamora,http://universidaddezamora.edu.mx
University Studies Centre of Monterrey,Monterrey,http://www.ceu.edu.mx
University Studies Centre of the Gulf,Xalapa,Webpage-Not-Found
University Studies Centre of the North,Ciudad Delicias,http://www.ceun.com.mx
UREG University Centre,Guadalajara,http://www.uteg.edu.mx
Valladolid University,Las Trancas,http://www.iesvalladolid.edu.mx
Valle de Perote Latin American Higher Education Centre,Perote,Webpage-Not-Found
Vasco de Quiroga School of Social Work,Comala,http://www.etsvascodequiroga.edu.mx/
Vasco de Quiroga University,Morelia,http://www.uvaq.edu.mx
Vasco de Quiroga University Centre of Huejutla,Huejutla de Reyes,http://cuvaqhstj.edu.mx
Vasconcelos University of the South-East,Minatitlán,http://www.usv.edu.mx
Veracruz Centre for Advanced Studies,Veracruz,http://universidad.cesuver.edu.mx/
"Veracruz Higher Education Centre, Tantoyuca Campus",Tantoyuca,https://cevescom.wordpress.com
Veracruz Institute of Haute Cuisine,Veracruz,http://www.ivacmx.com
Veracruz Studies Centre,Boca del Río,http://www.cev.edu.mx
Villa del Espiritu Santo Institute,Coatzacoalcos,Webpage-Not-Found
Villa Rica University,Boca del Río,http://www.univillarica.mx
Villanueva Montaño School of Accountancy and Administration,México,http://www.villanuevamontano.edu.mx
Villasunción University,Aguascalientes,http://www.uvas.edu.mx
Virtual University for Superior Studies,Guadalajara,http://unives.com.mx
Virtual University of the State of Guanajuato,Purísima del Rincón,https://www.uveg.edu.mx
