institute,city,url
Institute of Public Administration of the State of Guanajuato,Guanajuato,Webpage-Not-Found
Institute of Public Administration of the State of Hidalgo,Pachuca,http://www.iaphidalgo.org/
Institute of Public Administration of the State of Jalisco,Guadalajara,http://www.iapjalisco.org.mx
Institute of Public Administration of the State of Mexico,Toluca,http://www.iapem.org.mx
Institute of Public Administration of the State of Puebla,Puebla,http://iappuebla.edu.mx
Institute of Public Administration of the State of Sinaloa,Culiacán,http://www.iapsin.org.mx
Institute of Public Administration of the State of Tabasco,Villahermosa,Webpage-Not-Found
Institute of Public Administration of the State of Veracruz,Nuevo Xalapa,http://www.iapver.edu.mx
Institute of Rational Emotional Behaviour Therapy,México,http://www.itrec.org
Institute of Science and Culture,Saltillo,http://www.iccac.edu.mx
Institute of Science and Higher Education,Hermosillo,http://www.ices.edu.mx
Institute of Science and Higher Studies of Tamaulipas,Tampico,http://www.icest.edu.mx
"Institute of Science, Humanities and Technology of Guanajuato",Irapuato,http://www.icyteg.com.mx/
Institute of Social Sciences of Merida,Mérida,Webpage-Not-Found
"Institute of Social Sciences, Economics and Administration",México,Webpage-Not-Found
Institute of Specialized Studies for Executives,México,http://www.iee.com.mx
Institute of Technological and Advanced Studies of Matatipac,Tepic,http://institutomatatipac.edu.mx
Institute of Technology and Higher Studies of Nayarit,Tepic,http://www.itesnay.edu.mx/tepic
Institute of Tourism Studies of Chihuahua,Chihuahua,Webpage-Not-Found
Institute of University Studies of León,León,Webpage-Not-Found
Institute of Visual Arts of the State of Puebla,Puebla,http://www.artesvisualespuebla.mx
Insurgentes University,México,http://www.universidadinsurgentes.edu.mx
INTEC Advanced Studies in Computer Science,Puebla,http://www.dasc.com.mx
Integral Centre for Fashion and Design,Guadalajara,http://www.cimemoda.edu.mx
Integral Centre of Sexuality and Sexual Education,Xalapa,http://www.cisesdexalapa.es.tl
Integral University Centre of Zacatlán,Zacatlán,http://cuiza.edu.mx
Inter-American Centre for Social Security Studies,México,http://www.ciess.org/
Inter-American University,San Andrés Cholula,http://www.lainter.edu.mx
"Inter-American University for Development, Tlalnepantla",Tlalnepantla,http://www.unid.edu.mx
Inter-American University of Cuernavaca,Cuernavaca,http://www.unit.edu.mx
Inter-American University of the North and of Technology of the Sierra Madre,Monterrey,http://www.uin.com.mx
Interactive and Distance University of the State of Guanajuato,Acámbaro,http://unidegacambaro.netii.net
Intercontinental Centre for Advanced Studies,Silao,Webpage-Not-Found
Intercontinental University,México,http://www.uic.edu.mx
Intercultural Indigenous University of Michoacan,Pátzcuaro,http://www.uiim.edu.mx
Intercultural University of Chiapas,San Cristóbal de Las Casas,http://www.unich.edu.mx
Intercultural University of San Luis Potosi,San Luis Potosí,http://www.uicslp.edu.mx
Intercultural University of the State of Guerrero,Malinaltepec,Webpage-Not-Found
Intercultural University of the State of Hidalgo,Tenango de Doria,http://www.universidadinterculturalhgo.edu.mx
Intercultural University of the State of Mexico,San Felipe del Progreso,http://www.uiem.edu.mx
Intercultural University of the State of Puebla,Huehuetla,http://www.uiep.edu.mx
Intercultural University of the State of Tabasco,Tacotalpa,http://www.uiet.edu.mx
Intercultural University of Veracruz,Xalapa,http://www.uv.mx/uvi
Interdisciplinary Centre for Research and Teaching in Technical Education,Querétaro,http://www.ciidet.edu.mx
International Centre of Advanced Studies of Morelos,Cuernavaca,http://www.cies.com.mx
International College of Gastronomy,Guadalajara,http://www.colegiogastronomico.com
International College of Higher Education,México,http://www.cies-mex.edu.mx
International Faculty of Educational Sciences,Tijuana,http://www.ficed.org
"International Institute of Higher Studies, Tamaulipas",Reynosa,http://www.iies.edu.mx
International Professional Development Centre,Veracruz,Webpage-Not-Found
International School of Tourism/ International University of the Professions,México,http://www.unipro.edu.mx
International Technological University,Tecámac,http://www.formacionenlineauti.com
International University,México,http://www.internacional.edu.mx
International University,Monterrey,http://www.universidadinternacional.com.mx
International University,Cuernavaca,http://www.uninter.edu.mx
International University Centre,México,http://cuin.edu.mx
International University for Development,México,Webpage-Not-Found
International University of La Paz,La Paz,http://www.unipaz.edu.mx
Interserrana University of the State of Puebla-Ahuacatlán,Ahuacatlán,http://www.uiepa.edu.mx
Interserrana University of the State of Puebla-Chilchotla,Chilchotla,http://www.uich.edu.mx
Irish University Centre,Puebla,http://www.centrouniversitarioirlandes.edu.mx/_pages/inicio.html
ISEC University of Business Studies,México,http://uneg.edu.mx
Isidro Espinosa de los Reyes National Institute of Perinatal Studies,México,http://www.inper.edu.mx
Isidro Fabela University Centre,Cuautitlán Izcalli,http://www.pcu.edu.mx
Isidro Fabela University of Toluca,Toluca,http://www.uift.com.mx/
ISSSTE Dietetics and Nutrition School,México,https://edn.issste.gob.mx/
Itaca University,México,http://www.i.edu.mx
ITIAN University,Poza Rica,http://www.itian.edu.mx
IVES University,Xalapa,http://www.ives.edu.mx
Jaime Torres Bodet Institute of Higher Education,Acapulco de Juárez,Webpage-Not-Found
Jalisco Institute of Psychoanalysis and Psychotherapy,Guadalajara,http://www.apj.org.mx
Jean Piaget University,Veracruz,http://www.universidadjeanpiaget.com
Jesus Aquino Juan School of Social Work,Tuxtla Gutiérrez,http://www.trabajosocialchiapas.com.mx
Jesus Hospital Nursing School,México,Webpage-Not-Found
José Maria Morelos Institute of Educational Sciences of Michoacan,Morelia,http://www.imced.edu.mx
José Vasconcelos University Centre,México,http://www.cujv.edu.mx
José Vasconcelos University of Oaxaca,Oaxaca,http://www.univas.mx
Juan Bosci Institute of Higher Education,Coatzacoalcos,http://www.universidadjuanbosco.com
Juan Ruiz de Alarcón Institute of Higher Studies,Taxco de Alarcón,http://www.iesjra.edu.mx
Juana de Asbaje University Centre,Zamora,Webpage-Not-Found
Juarez Autonomous University of Tabasco,Villahermosa,http://www.ujat.mx
"Juarez Autonomous University of Tabasco
Los Rios Branch",Tenosique,http://www.ujat.mx/damr
"Juarez Autonomous University of Tabasco
Chontalpa Campus",Conduacán,Webpage-Not-Found
"Juarez Autonomous University of Tabasco
Sierra Unit",Villahermosa,Webpage-Not-Found
Juárez University of the State of Durango,Durango,https://www.ujed.mx
Justo Sierra Continental University,Jiutepec,http://www.unicon.edu.mx
Justo Sierra Hispanic-American University,San Francisco de Campeche,http://universidadhispanoamericana.edu.mx
Justo Sierra Méndez Rural Teacher Training School,Aguascalientes,Webpage-Not-Found
Justo Sierra Méndez School of Tourism,Ciudad del Carmen,Webpage-Not-Found
Justo Sierra O'Reilly CTM Centre for Advanced Studies,Mérida,http://www.cesctm.edu.mx/
Justo Sierra University,México,http://www.universidad-justosierra.edu.mx
Justo Sierra University - San Luis Potosi,Rioverde,http://www.universidadjustosierra.edu.mx
Kino University,Hermosillo,http://www.unikino.mx
"La Antigua University Studies Centre, Veracruz",Veracruz,Webpage-Not-Found
La Ciénega University,Poncitlán,http://www.ucienega.edu.mx
La Concordia University,Aguascalientes,http://www.universidadlaconcordia.edu.mx
La Salle College of la Montaña,Silao,Webpage-Not-Found
"La Salle University
De La Salle University Bajio",León,http://bajio.delasalle.edu.mx
"La Salle University
De La Salle Bajio University Campus Salamanca",Salamanca,http://bajio.delasalle.edu.mx/salamanca.php
"La Salle University
La Salle University Benavente",Puebla,http://www.universidadlasallebenavente.edu.mx
"La Salle University
La Salle University Cancun",Cancún,http://lasallecancun.edu.mx
"La Salle University
La Salle University Chihuahua",Chihuahua,http://ulsachihuahua.edu.mx
"La Salle University
La Salle University Cuernavaca",Cuernavaca,http://www.ulsac.edu.mx
"La Salle University
La Salle Laguna University",Gómez Palacio,http://www.ulsalaguna.edu.mx
"La Salle University
La Salle University Morelia",Tarímbaro,http://www.lasallemorelia.edu.mx
"La Salle University
La Salle University Nezahualcóyotl",Ciudad Nezahualcóyotl,http://ulsaneza.edu.mx
"La Salle University
La Salle University Northwest",Ciudad Obregón,http://www.ulsa-noroeste.edu.mx
"La Salle University
La Salle University Oaxaca",Santa Cruz Xoxocotlán,http://www.ulsaoaxaca.edu.mx
"La Salle University
La Salle University Pachuca",San Agustín Tlaxiaca,http://www.lasallep.edu.mx/ulsaweb/index.php
"La Salle University
La Salle University Saltillo",Saltillo,http://www.ulsasaltillo.edu.mx
"La Salle University
La Salle University Victoria",Ciudad Victoria,http://www.ulsavictoria.edu.mx
La Silla Institute,Guadalupe,Webpage-Not-Found
Labastida College,San Pedro Garza García,http://www.colegiolabastida.edu.mx
Lagrange Institute of Higher Studies,México,Webpage-Not-Found
Lamar Guadalajara University,Guadalajara,http://www.lamar.edu.mx
LANIA Teaching Centre,Xalapa Enríquez,http://www.lania.mx
Lanspiac Studies Centre,Guadalajara,Webpage-Not-Found
Las Americas de Veracruz University Centre,Veracruz,http://www.ceulasamericas.com
Lasalle Benavente University,Celaya,Webpage-Not-Found
Latin America University,Guadalajara,http://www.ual.edu.mx
Latin American Centre of Orthodontic Studies,México,http://cleo.mx
Latin American Centre of University Studies CEUL,Veracruz,Webpage-Not-Found
Latin American Faculty of Social Sciences,México,http://www.flacso.edu.mx
Latin American Institute for Educational Technology and Communication,Puebla,Webpage-Not-Found
Latin American Institute of Educational Communication,México,http://www.ilce.edu.mx
Latin American Institute of Science and Humanities,León,http://www.ilaleon.com/
Latin American Scientific University of Hidalgo,Pachuca de Soto,http://www.uclah.edu.mx
Latin American Technological Institute,Mineral de la Reforma,http://www.itla.edu.mx
Latin American University,México,http://www.ula.edu.mx
Latin University,México,http://www.unila.edu.mx
Latin University of America,Morelia,http://unla.mx
Latin University of Mexico,Celaya,http://www.ulm.edu.mx
Latino University,Mérida,www.universidadlatino.edu.mx
Laura Arce School of Educators,Monterrey,http://www.lauraarce.edu.mx/
Laurens Institute,Monterrey,Webpage-Not-Found
Law School of Atlacomulco,Metepec,Webpage-Not-Found
Law School of the State of Mexico,Toluca,http://www.pjedomex.gob.mx/ejem
Le Chef College,Boca del Río,http://www.lechefcollege.edu.mx
Leona Vicario Centre for Advanced Studies,Coatzacoalcos,http://www.escleonavicario.com/
Leonardo Bravo Institute,México,http://ilb.mx
Lerdo University Unit,Ciudad Lerdo,Webpage-Not-Found
Libertad School of Higher Education,Salamanca,http://universidad-libertad.tripod.com/index.html
Lic. Adolfo López Mateos Regional Teacher Training Centre,Iguala,Webpage-Not-Found
Lic. Jesús Rojas Villavicencio Law School,Huajuapán de León,Webpage-Not-Found
Lic. Miguel Alemán School Tlaxcala,Acuitlapilco,http://www.esmav.com.mx
Lipro Educational Centre,Guadalajara,Webpage-Not-Found
Liverpool Training Institute,México,http://www.uvl.com.mx
Loma Centre of Family Studies,México,http://www.loma.org.mx
Londres University,México,http://www.udlondres.com
Los Altos de Chiapas University,San Cristóbal de Las Casas,http://www.uach.edu.mx
Loyola University of America,Cuernavaca,http://www.universidadloyola.edu.mx
Loyola University of the Pacific,Acapulco de Juárez,http://www.loyola.edu.mx
Lucerna University,Coacalco de Berriozábal,http://www.lucerna.edu.mx
Luis Buñuel School of Cinema Studies of Veracruz,Xalapa,http://veracruzanadecine.com/inicio
Luis Donaldo Colosio Murrieta University Centre,Huajuapán de León,http://cucolosio.edu.mx
Luis Hidalgo Monroy Centre for Higher Studies in Rural Education,Tantoyuca,Webpage-Not-Found
Lyceum of Advanced Studies,Querétaro,http://www.de-paseo.com/liceo/liceo.htm
Madero University,Puebla,http://www.umad.edu.mx
Maestro Rafael Ramírez Experimental Teacher Training School,Mexicali,http://www.normalrafaelramirez.com.mx
Manuel Avila Camacho Benemérita Teacher Training School of Zacatecas,Zacatecas,http://benmac.edu.mx
Manuel José de Rojas Institute of Higher Studies,San Cristóbal de Las Casas,http://www.ies.edu.mx
Marcelo Rubio Ruiz Regional Teacher Training Centre,Loreto,http://www.crenloreto.com
Margarita Olivo Lara Educational Institute,Coatzacoalcos,http://www.iemol.edu.mx
María Esther Zuno de Echeverria Institute of Psychology,Torreón,http://www.meze.com.mx
María Teresa Zazueta y Zazueta School of Social Communication,Culiacán,Webpage-Not-Found
Marillac Institute,México,http://www.institutomarillac.edu.mx
Marist University,México,http://www.uma.maristas.edu.mx
"Marist University
Marist University of Guadalajara",Zapopan,http://umg.edu.mx/portal
"Marist University
Marist University of Merida",Merida,http://www.marista.edu.mx/
"Marist University
Marist University of San Luis Potosi",San Luis Potosí,http://umaslp.maristas.edu.mx
Mater Institute of the Holy Heart,Garza García,http://www.imac.edu.mx
Mathematics Research Centre,Guanajuato,http://www.cimat.mx
Matias Romero Institute,México,http://www.sre.gob.mx/imr/
Maya Intercultural University of Quintana Roo,José María Morelos,http://www.uimqroo.edu.mx
Maya International University of Cancun,Cancún,Webpage-Not-Found
Maya University,Tuxtla Gutiérrez,https://www.universidadmaya.edu.mx
Maya University of the Americas,Cancún,http://uma.edu.mx
Maya World University,Villahermosa,http://www.umma.com.mx
Merchant Navy School of Tampico,Tampico,www.fidena.edu.mx
Meso-American Institute,Nezahualcóyotl,Webpage-Not-Found
Meso-American University,Oaxaca,http://www.universidadmesoamericana.edu.mx
Meso-American University of San Agustín,Mérida,http://www.umsa.edu.mx
"Meso-American University, Puebla",Puebla,http://www.umaweb.edu.mx
Mesoamerican Polytechnic University,Tenosique,http://www.upm.edu.mx
Metropolitan Institute of Applied Sciences,Juchitán de Zaragoza,Webpage-Not-Found
Metropolitan Polytechnic University of Hidalgo,Tolcayuca,http://www.upmetropolitana.edu.mx
Metropolitan Technological University,Mérida,http://www.utmetropolitana.edu.mx
Metropolitan University of Coahuila,Monclova,Webpage-Not-Found
Metropolitan University of Monterrey,Monterrey,http://www.umm.edu.mx
Metropolitan University of Puebla,Puebla,Webpage-Not-Found
Metropolitan University of the Centre,Jerez de García Salinas,http://www.umcentro.edu.mx
Metropolitan University of Xalapa,Xalapa,http://www.umx.edu.mx
Metropolitan University Universidad Metropolitana Latin Campus,Guadalajara,http://www.umla.edu.mx
Mexican Academy of Fiscal Research,México,Webpage-Not-Found
Mexican Art Centre,México,http://www.centrodeartemexicano.edu.mx
"Mexican Association for Practice, Research and Teaching of Psychoanalysis",México,http://www.ampiep.org
Mexican Association of Psychoanalytic Psychotherapy for Children and Adolescents,México,Webpage-Not-Found
Mexican Centre for Neuro-linguistic Programming,Guadalajara,http://www.cmpnl.edu.mx
Mexican Centre in Stomatology,Puebla,http://www.cme.edu.mx
Mexican Centre of Postgraduate Studies,Xalapa,http://cmece.com.mx
Mexican Corporation for Materials Research,Saltillo,http://www.comimsa.com.mx
Mexican Council of Geriatrics and Gerontology,Puebla,http://www.geriatriapuebla.com/
Mexican Dentistry Association for Teaching and Research,México,Webpage-Not-Found
Mexican Hearing and Language Institute,México,http://www.imal.org.mx
Mexican Institute of Cognitive and Behavioural Psychotherapy,México,http://www.tcognitiva.org
Mexican Institute of Higher Studies,Torreón,http://imes.edu.mx
Mexican Institute of Matrimonial Studies,México,http://www.ametep.com.mx
Mexican Institute of Professional Education,México,http://www.imeprofesional.com.mx
Mexican Institute of Psychopedagogy,México,Webpage-Not-Found
Mexican Institute of Sexology,México,http://www.imesex.edu.mx
Mexican Institute of Tourism Studies,Monterrey,http://www.inmextur.com.mx
Mexican Petroleum Institute,México,http://www.imp.mx/
Mexican School of Tourism,México,http://www.emt2003.net/
Mexican Technological Institute,México,Webpage-Not-Found
Mexican University,México,http://www.unimex.edu.mx
Mexican University of Distance Education,Cuernavaca,http://www.umed.edu.mx
Mexican University of the North-East,Monterrey,Webpage-Not-Found
Mexico Culinary Institute,Puebla,http://www.icum.edu.mx
Mexico-American University Institute,Guadalupe,http://www.iuma.edu.mx
Mexico-American University of the North,Ciudad Reynosa,http://www.uman.edu.mx
Mexiquense University,Toluca,http://umex.edu.mx
Michoacan University of Saint Nicholas of Hidalgo,Morelia,https://www.umich.mx
Michoacan University of the East,Zitácuaro,http://www.umo.edu.mx
Miguel Alemán University,Ciudad Miguel Alemán,http://www.unimiguelaleman.edu.mx
Miguel Alemán Valdés School Centre,Mérida,http://www.cema.edu.mx
Miguel Hidalgo College,Puebla,http://www.colegiomiguelhidalgo.edu.mx
Miguel Hidalgo Regional University,Ciudad Madero,http://www.urmh.edu.mx
Miguel Hidalgo Rural Teacher Training School,Atequiza,Webpage-Not-Found
Millennium University of Mexico,Zacoalco de Torres,Webpage-Not-Found
Mixtec Institute of Integral Education,Izúcar de Matamoros,Webpage-Not-Found
Modelo University,Mérida,http://www.unimodelo.edu.mx/univ
Modelo University and Technological Institute,Coacalco de Berriozábal,http://www.universitariomodelo.edu.mx
Modern University College,Jilotepec,Webpage-Not-Found
Monte Fenix Centre for Advanced Studies,México,http://www.cesmf.edu.mx
Montecristo College,Villahermosa,Webpage-Not-Found
Morelos Centre for the Arts of the State of Morelos,Cuernavaca,http://www.cmamorelos.edu.mx
Morelos Institute of Higher Studies,Xalapa,http://www.escuelamorelos.edu.mx/instituto.html
Morelos University of Cuernavaca,Cuernavaca,Webpage-Not-Found
Motolinía University of the Pedegral,México,http://www.universidadmotolinia.edu.mx
Mukila Mazo School of Art,Culiacán,Webpage-Not-Found
Multicultural International University,Tampico,Webpage-Not-Found
Multidisciplinary Specialization Institute,Oaxaca,http://www.ime.edu.mx
Multitechnical Professional Institute,Colima,http://www.institutomultitecnico.edu.mx
Municipal School of Engineering,México,Webpage-Not-Found
Music and Arts Conservatoire of Celaya,Celaya,http://www.conservatoriocelaya.edu.mx
Music Conservatoire of the State of Mexico,Toluca,http://comem.edomex.gob.mx
Music Conservatoire of the State of Puebla,Puebla,http://www.consermuspue.edu.mx
Nandehui Institute of Scenic Arts Xalapa,Xalapa Enríquez,Webpage-Not-Found
Narvarte University Centre,México,http://www.cunarvarte.edu.mx
Nation University Centre,México,http://www.cup.edu.mx
National Autonomous University of Mexico,México,https://www.unam.mx
"National Autonomous University of Mexico
National School of Professional Studies Acatlán",Santa Cruz Acatlán,http://www.acatlan.unam.mx
"National Autonomous University of Mexico
National School of Professional Studies Aragón",Ciudad Nezahualcóyotl,http://www.informatica.aragon.unam.mx
"National Autonomous University of Mexico
Faculty of Advanced Studies Cuautitlán",Cuautitlán Izcalli,http://www.cuautitlan2.unam.mx
"National Autonomous University of Mexico
Faculty of Advanced Studies Iztacala",Tlalnepantla,http://www.iztacala.unam.mx
"National Autonomous University of Mexico
Faculty of Advanced Studies Zaragoza",México,http://www.zaragoza.unam.mx
National Centre for Research and Technological Development,Cuernavaca,http://www.cenidet.edu.mx
National College of Contemporary Dance,Querétaro,http://www.conadaco.org.mx
National Institute of Anthropology and History,Districto Federal,http://www.inah.gob.mx/es/academia/escuelas
"National Institute of Anthropology and History
National Institute of Anthropology and History of Mexico",Guadalupe,http://eahnm.edu.mx
"National Institute of Anthropology and History
National School of Anthropology and History",México,http://www.enah.edu.mx
"National Institute of Anthropology and History
Manuel del Castillo Negrete National School of Conservation, Restoration and Museography",México,http://www.encrym.edu.mx
"National Institute of Astrophysics, Optics and Electronics",Puebla,http://www.inaoep.mx
National Institute of Fine Arts and Literature,México,http://.bellasartes.gob.mx
"National Institute of Fine Arts and Literature
National Conservatory of Music",México,Webpage-Not-Found
"National Institute of Fine Arts and Literature
School of Theatre",México,http://www.enat.bellasartes.gob.mx
"National Institute of Fine Arts and Literature
School of Design",México,http://www.edinba.bellasartes.gob.mx
"National Institute of Fine Arts and Literature
National School of Classical and Contemporary Dance",México,Webpage-Not-Found
"National Institute of Fine Arts and Literature
Nelly y Gloria Campobello National School of Dance",México,http://www.endngcampobello.bellasartes.gob.mx
"National Institute of Fine Arts and Literature
La Esmeralda National School of Painting, Sculpture and Drawing of the INBA",México,Webpage-Not-Found
"National Institute of Fine Arts and Literature
School of Music",México,http://www.escuelasuperiordemusica.bellasartes.gob.mx
"National Institute of Fine Arts and Literature
Monterrey Higher School of Music and Dance",Monterrey,http://esmdm.edu.mx
National Institute of Fiscal Studies,Tuxtla Gutiérrez,http://www.inef.com.mx
National Institute of Higher Studies in Penal Law,México,http://www.indepac.edu.mx
National Institute of Orthodoncy and Maxillary Orthopedics,Guadalajara,http://www.inoom.com
National Institute of Penal Studies,México,http://www.inacipe.gob.mx/
National Institute of Public Administration,México,http://www.inap.org.mx/
National Institute of Public Health,Cuernavaca,http://www.insp.mx
National Institute of Rehabilitation,México,http://www.inr.gob.mx
National Paediatrics Institute,México,http://www.pediatria.gob.mx/
"National Research Institute in Forestry, Agriculture and Stockbreeding",México,http://www.inifap.gob.mx/
National School of Library Science and Archiving,México,http://www.enba.sep.gob.mx
National School of Sports Trainers,México,http://ened.conade.gob.mx
National University of Education Sciences,México,http://www.upn.mx
Navy Medical School of the Naval Secretariat,México,http://www.semar.gob.mx/
New England Institute of Higher Studies,México,http://www.institutonuevainglaterra.edu.mx
New Millennium Education,Celaya,http://www.enm.edu.mx
New World University,Huixquilucán,Webpage-Not-Found
Nicolás Guillén Cultural Institute,Tlalnepantla,http://www.nicolasguillen.edu.mx
Norman Rockwell School of Illustration,Toluca,http://norman_rockwell.mx.tripod.com
Nuestra Señora de la Salud Hospital Nursing School,Morelia,Webpage-Not-Found
Nuevo León College of Bioethics,Monterrey,http://colegiodebioetica.org.mx
Núñez Fragoso Institute of Higher Studies,México,Webpage-Not-Found
Nursing School of Mexicali,Mexicali,Webpage-Not-Found
Nursing School of the Red Cross of San Luis Potosi,San Luis Potosí,Webpage-Not-Found
Nursing School of Tuxtla Gutiérrez,Tuxtla Gutiérrez,Webpage-Not-Found
Nursing School of Zamora,Zamora,http://www.escueladeenfermeriadezamora.org
Nursing Schools of the Mexican Social Security Institute,México,http://edumed.imss.gob.mx/edumed/pagEnferMision.html
"Nursing Schools of the Mexican Social Security Institute
Nursing School of the National Medical Centre Siglo XXI",México,Webpage-Not-Found
"Nursing Schools of the Mexican Social Security Institute
Nursing School of the city of Obregon",Ciudad Obregón,Webpage-Not-Found
"Nursing Schools of the Mexican Social Security Institute
Nursing School of Guadalajara",Guadalajara,Webpage-Not-Found
"Nursing Schools of the Mexican Social Security Institute
Nursing School of Hermosillo",Hermosillo,http://escuelaimsshermosillo.com/sitio/
"Nursing Schools of the Mexican Social Security Institute
Nursing School of Mérida",Mérida,Webpage-Not-Found
"Nursing Schools of the Mexican Social Security Institute
Nursing School of Monterrey",Monterrey,Webpage-Not-Found
"Nursing Schools of the Mexican Social Security Institute
Nursing School of Tijuana",Tijuana,Webpage-Not-Found
Oaxaca University Institute,Oaxaca,http://iuo.edu.mx
Official Higher Teacher Training School of Guanajuato,Guanajuato,Webpage-Not-Found
Official Teacher Training School of Irapuato,Irapuato,http://home.enoi.edu.mx/
Olimpo Centre for Advanced Studies,Toluca,http://www.olimpo.edu.mx
Olmec University,Villahermosa,http://www.olmeca.edu.mx
Online Latin American Technological University,Naucalpan de Juárez,https://www.utel.edu.mx
Oparin University,Ecatepec de Morelos,Webpage-Not-Found
Open University,San Luis Potosí,http://www.universidadabierta.edu.mx
Optical Research Centre,León,http://www.cio.mx/
Oxford Educational Consortium,Monterrey,http://www.ceox.edu.mx
Pablo García Ávalos Teacher Training School in Physical Education,Villahermosa,http://www.enef-tabasco.com.mx
Pablo Guardado Chávez University,Tuxtla Gutiérrez,http://www.upgch.edu.mx
Paccioli University of Córdoba,Córdoba,http://www.universidadpaccioli.edu.mx
